Command,Description
:CALCulate{[1]|2|3|4|5|6|7|8|9}[:SELect ed]:CORRecti on:EDELay:TIME <n umeric>,Part with headingﬁDescriptionﬂdescribes how touse the command or the operation when executed.
*CLS,Clears the followings. (No query) ŁError Queue ŁStatus Byte Register  ŁStandard Event Status Register  ŁOperation St atus Event Regi st er  ŁQuestionable Status Event Register  ŁQuestionable Limit StatusEvent Register  ŁQuestionable Limit Extra Status EventRegister  ŁQuest ionable Li mi t Channel {1-16} St atus Event Regi st er  ŁQuest ionable Li mi t Channel {1-16 } Extra Status EventRegister ŁQuestionable Bandwidth Limit Status Event Register  ŁQuestionable BandwidthLimitExtra Status Event Register  Ł Questionable Bandwidth Limit Channel{1-16} Status Event Register  ŁQuestionab le Bandwidth LimitCh annel{1 -1 6}Ex tra Status Event Register  ŁQuestionable Ripple Limit Status Event Register  Ł Questionable RippleLimitExtra Status Event Register  ŁQuestionable RippleLimitChannel{1-16} Status Event Register  ŁQuestionable Ripple Limit Channel{ 1-16} Extra Status EventRegister
*ESE <numeric> *ESE?,Sets the value of the Standard Event Status Enable Register.
*ESR?,Reads out the value of the St andardEvent Status Register . Executing this command clears the register v alue. (Query only)
*IDN?,"Reads out the product inform ation (manufacturer, model nu mber, serial number, and firmware version number) of the E5070B/E5071B.(Query only)"
*OPC,SetstheO PC bit (bit 0) ofthe Standard Event Status Register at the completion ofall pending operations. (No query)
*OPC?,1 is read outatthe completion ofallpending operations. (Query only)
*OPT?,Reads out the identification number of an option installed in the E5070B/E5071B. (Query only)
*RST,Performs preset. There is the following differ ence from thesettingst atepreset with the :SYST:PRES command. (No query) ŁThe continuousinitiation modeof channel 1 isset toOFF.
*SRE <numeric> *SRE?,Sets the value of the Service Request Enable Register.
*STB?,Reads out the value of the Status Byte Register. (Query only)
*TRG,"Ifthe triggersource is setto GPIB/LAN(set to BUSwiththe :TRIG:SOUR command), triggersthe E5070B/E5071B waiting for a trigger. (Noquery)"
*WAI,Waits for the executionof all commands sent before this co mmandto be completed. (No query)
:ABORt,"Aborts the measurement and chan ges the trigger sequence for all channels to idle state. (No query) After thechange to the idle st ate,thechannels for which the continuous initiation mode is set to ON (set to ON with the :INIT{1-16}:CONT command)change into the initiate state. For details about the trigger system, refer to ﬁTrigger Systemﬂ on page128. (No query)"
:CALCulate{[1]|2|3|4|5|6|7|8|9|10|11|12|13|14| 15|16}[:SELected]:BLIM it[:STATe] {ON|OFF|1|0} :CALCulate{[1]|2|3|4|5|6|7|8|9|10|11|1 2|13|14|15|16}[:SELected]:BLIMit[:STATe]?,"For the active trace ofchan nel 1 (:CALC1)to channel16 (: CALC16)(specified with the :CALC{1-16}:PAR{1-16}:SEL command), turns ON/OFF the bandwidth test func tion."
:CALCulate{[1]|2|3|4|5|6|7|8|9|10|11|12|13| 14|15|16}[:SELected]:B LIMit:DB <numeric> :CALCulate{[1]|2|3|4|5|6|7|8|9|10|11 |12|13|14|15|16}[:SELected]:BLIMit:DB?,"For channel 1 (:CALC1) tochannel 16(:CALC16) (specifiedwiththe :CALC{1-16}:PAR{1-16}:SEL command), sets the bandwidth threshold value (attenuationfrom the peak) of thebandwidthtest."
:CALCulate{[1]|2|3|4|5|6|7|8|9|10|11|12|13| 14|15|16}[:SELected]:BLI Mit:DISPlay:MARKer {ON|OFF|1|0} :CALCulate{[1]|2|3|4|5|6|7|8|9|10|11|12|13| 14|15|16}[:SELected]:BLI Mit:DISPlay:MARKer?,"For the active trace ofchan nel 1 (:CALC1)to channel16 (: CALC16)(specified with the :CALC{1-16}:PAR{1-16}:SEL command), turns ON/OFF th e marker display ofthe bandwidth test."
:CALCulate{[1]|2|3|4|5|6|7|8|9|10|11|12|13| 14|15|16}[:SELected]:B LIMit:DISPlay:VALue {ON|OFF|1|0} :CALCulate{[1]|2|3|4|5|6|7|8|9|10|11|12|13| 14|15|16}[:SELected]:B LIMit:DISPlay:VALue?,"For the active trace ofchan nel 1 (:CALC1)to channel16 (: CALC16)(specified with the :CALC{1-16}:PAR{1-16}:SEL command), turnsO N/O FFthe bandw idthvalue display of the bandwidth test."
:CALCulate{[1]|2|3|4|5|6|7|8|9|10|11|12|13|14|15|16}[:S ELected]:BLIMit:FAIL?,"For the active trace ofchan nel 1 (:CALC1)to channel16 (: CALC16)(specified with the :CALC{1-16}:PAR{1-16}:SEL command), reads outthe bandwidth test result. (Query only)"
:CALCulate{[1]|2|3|4|5|6|7|8|9|10|11|12|13|14| 15|16}[:SELected]:BLIMit:MAXimum <numeric> :CALCulate{[1]|2|3|4|5|6|7|8|9|10|11|1 2|13|14|15|16}[:SELecte d]:BLIMit:MAXimum?,"For channel 1 (:CALC1) tochannel 16(:CALC16) (specifiedwiththe :CALC{1-16}:PAR{1-16}:SEL command), setstheupperlimit valueof the bandwidth test."
:CALCulate{[1]|2|3|4|5|6|7|8|9|10|11|12|13|14| 15|16}[:SELected]:BLIMit:MINimum <numeric> :CALCulate{[1]|2|3|4|5|6|7|8|9|10|11|1 2|13|14|15|16}[:SELecte d]:BLIMit:MINimum?,"For channel 1 (:CALC1) tochannel 16(:CALC16) (specifiedwiththe :CALC{1-16}:PAR{1-16}:SEL command), setsthelowerlimit valueof the bandwidth test."
:CALCulate{[1]|2|3|4|5|6|7|8|9|10|11|12|13| 14|15|16}[:SELected]:B LIMit:REPort[:DATA]?,"For the active trace ofchan nel 1 (:CALC1)to channel16 (: CALC16)(specified with the :CALC{1-16}:PAR{1-16}:SEL command), reads outthe bandwidth value ofthe bandwidth test. The data transfer format when this commandis executed depe ndson the setting withthe :FO RM:DATA command. (Query only)"
:CALCulate{[1]|2|3|4|5|6|7|8|9|10|11|12|13|14|15| 16}[:SELected]:CONVersion[:STATe] {ON|OFF|1|0} :CALCulate{[1] |2|3|4|5|6|7|8|9|10|11|12|13 |14|15|16}[:SELected]:CONVersion [:STATe]?,"For the active trace ofchan nel 1 (:CALC1)to channel16 (: CALC16)(specified with the :CALC{1-16}:PAR{1-16}:SEL command), turns ON/OFF the parameterconversion fu nction."
:CALCulate{[1]|2|3|4|5|6|7|8|9|10|11|12|13|14|15| 16}[:SELected]:CONVersion:FUNCtion {ZREFlection| ZT Ransmit|YREFlection|YTRansmit|INVe rsion|ZTSHunt|YTS Hunt|CONJugation} :CALCulate{[1] |2|3|4|5|6|7|8|9|10|11|12|13 |14|15|16}[:SELected]:CONVersion:FUNCtion?,"For the active trace ofchan nel 1 (:CALC1)to channel16 (: CALC16)(specified with the :CALC{1-16}:PAR{1-16}:SEL command), selectthe paramete r after conversion using the parameter conversion function."
:CALCulate{[1]|2|3|4|5|6|7|8|9|10|11|12|13|14|15|16}[:SELected]:CO RRection:EDELay:MED ium {COAXial|WAVeguide} :CALCulate{[1]|2|3|4|5|6|7|8|9|10|11|12|13|14|15|16}[:SELected]:CO RRection:EDELay:MED ium?,"To calculate the electrical de laytimeof channel1(:CALC1) to channel 16 (:CALC16), select the media type."
:CALCulate{[1]|2|3|4|5|6|7|8|9|10|11|12|13|14|15| 16}[:SELected]:CORRection:EDELay:TIME <numeric> :CALCulate{[1] |2|3|4|5|6|7|8|9|10|11|12|13 |14|15|16}[:SELected]:CORRection:EDELay:TIME?,Sets the electrical delay time oftheactive traceof channel1(:CALC1) to channel 16 (:CALC16) (specified with the :C ALC{1-16}:PAR{1-16}:SELcommand).
:CALCulate{[1]|2|3|4|5|6|7|8|9|10|11|12|13|14|15|16} [:SELected]:CORRection:EDELay:WGCutoff <numeric> :CALCulate{[1] |2|3|4|5|6|7|8|9|10|11|12|13|14|15|16}[:SELected]:CORRection:EDELay:WGCutoff?,"For channel 1(:CALC1)to channel16 (:CALC 16), setsthe cut-off frequency when the media type of the electrical delayis set to ﬁWaveguide.ﬂ"
:CALCulate{[1]|2|3|4|5|6|7|8|9|10|11|12|13|14|15| 16}[:SELected]:CORRection:OFFSet:PHASe <numeric> :CALCulate{[1] |2|3|4|5|6|7|8|9|10|11|12|13 |14|15|16}[:SELected]:CORRection:OFFSet:PHASe?,Sets the phase offset of the active trace of channel 1 (:CALC1)to channel 16 (:CALC16) (specified with the :CALC{1-16}:PAR{1-16}:SEL command).
":CALCulate{[1]|2|3|4|5|6|7|8|9|10|11|12|13|14|15|16}[:SELected]:DATA:FDATa <numeric1>, – ,<numeric NOP 2> :CALCul at e{[1]|2|3|4|5| 6|7| 8|9| 10|11|12| 13|14|15|16}[: SELected]: DATA:FDATa?","For the active trace ofchan nel 1 (:CALC1)to channel16 (: CALC16)(specified with the :CALC{1-16}:PAR{1-16}:SEL com mand), set s/reads out the form atted dat aarray. (It is the dataarray for which processing such asfo rmat has been performedforcorrecteddata array. For details,  refer to ﬁFor matted data arrayﬂ on page169.) The data transfer format when this commandis executed depe ndson the setting withthe :FO RM:DATA com m and."
":C ALC ulate{[1]|2|3|4|5|6|7|8|9|10|11|12|13|14|1 5|16}[:SELected]:DATA :FMEMory <numeric 1>, – ,<numeric NOP 2> :CALCulate{[1]|2|3|4|5|6|7|8|9|10|11|12|13|14|15|16}[:SELected]:DATA:FMEMory?","For the active trace ofchan nel 1 (:CALC1)to channel16 (: CALC16)(specified with the :CALC{1-16}:PAR{1-16}:SEL command), sets/reads out the formatted memory array. (It is the data array for whichprocessing such as format hasbeen pe rformed for corrected memory array.Forde tails, refer to ﬁForma ttedme mory arraysﬂ on page 170.) The data transfer format when this commandis executed depe ndson the setting withthe :FO RM:DATA com m and."
":CALCulate{[1]|2|3|4|5|6|7|8|9|10|11|12|13|14 |15|16}[:SELected]:DATA:SDATa <numeric 1>, – ,<numeric NOP 2> :CALCul at e{[1]|2|3|4|5| 6|7| 8|9| 10|11|12| 13|14|15|16}[: SELected]: DATA:SDATa?","For the active trace ofchan nel 1 (:CALC1)to channel16 (: CALC16)(specified with the :CALC{1-16}:PAR{1-16}:SEL command), sets/reads out the co rrected dataarray. (It is the data array for which processing such as er ror correction to measured raw data has been performed. For details,refertoﬁCorrected data arraysﬂ on page168.) The data transfer format when this commandis executed depe ndson the setting withthe :FO RM:DATA command."
":C ALC ulate{[1]|2|3|4|5|6|7|8|9|10|11|12|13|14|1 5|16}[:SELected]:DATA :SMEMory <numeric 1>, – ,<numeric NOP 2> :CALCulate{[1]|2|3|4|5|6|7|8|9|10|11|12|13|14|15|16}[:SELected]:DATA:SMEMory?","For the active trace ofchan nel 1 (:CALC1)to channel16 (: CALC16)(specified with the :CALC{1-16}:PAR{1-16}:SEL command), sets/reads out the corrected memory array. (It is the copyof the correcteddataarraywhen the :CALC{1-16}:MATH:MEM commandis executed.Fordetails,referto ﬁCorrected memory arraysﬂ on page168.) The data transfer format when this commandis executed depe ndson the setting withthe :FO RM:DATA command. (Query only)"
:CALCulate{[1]|2|3|4|5|6|7|8|9|10|11|12|13|14| 15|16}[:SELected]:EQUat ion:STATe {ON|OFF|1|0} :CALCulate{[1]|2|3|4|5|6|7|8|9|10|11|1 2|13|14|15|16}[:SELecte d]:EQUation:STATe?,"For the active trace ofchan nel 1 (:CALC1)to channel16 (: CALC16)(specified with the :CALC{1-16}:PAR{1-16}:SEL command), turns ON/OFF the cal culation function of the equation editor."
:CALCulate{[1]|2|3|4|5|6|7|8|9|10|11|12|13| 14|15|16}[:SELected]:EQU ation:TEXT <string> :CALCulate{[1]|2|3|4|5|6|7|8|9|10|11|1 2|13|14|15|16}[:SELecte d]:EQUation:TEXT?,"For the active trace ofchan nel 1 (:CALC1)to channel16 (: CALC16)(specified with the :CALC{1-16}:PAR{1-16}:SEL command), specifiestheequa tion and equationlabel used in theequation edit or.The equationl abel can be om itt ed."
:CALCulate{[1]|2|3|4|5|6|7|8|9|10|11|12| 13|14|15|16}[:SELected]:EQUation:VALid?,"For the active trace ofchan nel 1 (:CALC1)to channel16 (: CALC16)(specified with the :CALC{1-16}:PAR{1-16}:SEL command), reads outwhet her data specified by the equationinthe equation editoris valid orinvalid. Measurement data refers to ﬁMeas Data:ﬂ in the equation editor. Ifyou specify data that does notexist,that data is invalid. NOTE This commandcannot readout errors ofthe equation andequation label."
:CALCulate{[1]|2|3|4|5|6|7|8|9|10|11|12|13|14|15|16}[:SEL ected]:FILTer[:GATE]:TIME[:TYPE] {BPASs|NOT Ch} :CALCul at e{[1]|2|3|4|5| 6|7| 8|9| 10|11|12| 13|14|15|16}[:SELected]: FILTer[:GATE]:TIME[:TYPE]?,"For the active trace ofchan nel 1 (:CALC1)to channel16 (: CALC16)(specified with the :CALC{1-16}:PAR{1-16}:SEL command), selectsthe gate type used for the gating function of thetime domain func tion."
:CALCulate{[1]|2|3|4|5|6|7|8|9|10|11|12|13|14|15|16}[:SELected]:FILTer[:GATE]:TIME:CENTer <numeric> :CALCulate{[1] |2|3|4|5|6|7|8|9|10|11|12|13| 14|15|16}[:SELected]:FILTer[:GATE]:TIME:CENTer?,"For the active trace ofchan nel 1 (:CALC1)to channel16 (: CALC16)(specified with the :CALC{1-16}:PAR{1-16}:SEL command), sets the center value of the gate used for the gating function of the time domain function."
:CALCulate{[1]|2|3|4|5|6|7|8|9|10|11|12|13|14|15| 16}[:SELected]:FILTer[:GATE]:TIME:SHAPe {MAXimum| WIDE|NORMal|MINimum} :CALCulate{[1] |2|3|4|5|6|7|8|9|10|11|12|13| 14|15|16}[:SELected]:FILTer[:GATE ]:TIME :SHAPe?,"For the active trace ofchan nel 1 (:CALC1)to channel16 (: CALC16)(specified with the :CALC{1-16}:PAR{1-16}:SEL command), selectsthe sh ape of the gate used for the gating function of the time domain function."
:CALCulate{[1]|2|3|4|5|6|7|8|9|10|11|12|13|14|15| 16}[:SELected]:FILTer[:GATE]:TIME:SPAN <numeric> :CALCulate{[1] |2|3|4|5|6|7|8|9|10|11|12|13| 14|15|16}[:SELected]: FILTer[:GATE]:TIME:SPAN?,"For the active trace ofchan nel 1 (:CALC1)to channel16 (: CALC16)(specified with the :CALC{1-16}:PAR{1-16}:SEL command), setsthespanvalue ofthegate used for the gating function of the time domain function."
:CALCulate{[1]|2|3|4|5|6|7|8|9|10|11|12|13|14|15|16}[:SELected]:FILTer[:GATE]:TIME:STARt <numeric> :CALCulate{[1] |2|3|4|5|6|7|8|9|10|11|12|13| 14|15|16}[:SELected]:FILTer[:GATE]:TIME:STARt?,"For the active trace ofchan nel 1 (:CALC1)to channel16 (: CALC16)(specified with the :CALC{1-16}:PAR{1-16}:SEL command), setsthestart valu e of the gate used for the gating function of the time domain function."
:CALCulate{[1]|2|3|4|5|6|7|8|9|10|11|12|13|14|15|16}[:SELected]:FILTer[:GATE]:TIME:STATe {ON|OFF|1|0} :CALCulate{[1] |2|3|4|5|6|7|8|9|10|11|12|13| 14|15|16}[:SELected]:FILTer[:GATE]:TIME:STATe?,"For the active trace ofchan nel 1 (:CALC1)to channel16 (: CALC16)(specified with the :CALC{1-16}:PAR{1-16}:SEL command), turns ON/O FF the gating function of thetime domain function. Yo u can  turn  ON th e gating  function only when the sweep type is the linear sweep and the numberof points is 3or more.If you execute thiscommand totry toturnONthe gating  function when thesweep typeis other thanthe linear sweep or the number of points is less than3, an erroroccurs and the command isignored. Whenthe sweeptype is the power sweep,you cannot turn on thegatingfunction. Ifyou executethis commandtrying to turn onthe gating function during thepowersweep, an  erroroccurs and the com mand isi gnored."
:CALCulate{[1]|2|3|4|5|6|7|8|9|10|11|12|13|14|15|16}[:SELected]:FILTer[:GATE]:TIME:STOP <numeric> :CALCulate{[1] |2|3|4|5|6|7|8|9|10|11|12|13| 14|15|16}[:SELected]:FILTer[:GATE]:TIME:STOP?,"For the active trace ofchan nel 1 (:CALC1)to channel16 (: CALC16)(specified with the :CALC{1-16}:PAR{1-16}:SEL command), setsthestop valu eof the gate used for the gating function of the time domain function."
:CALCulate{[1]|2|3|4|5|6|7|8|9|10|11|12|13|14|15|16} [:SELected]: FORMat {MLOGarithmic|PHASe|GDELay| SLINear|SLOGarithmic|SCOMplex|S MITh|SADMittance|PLINear|PLOGarith mic|POLar|MLINear|SWR|REAL| IMAGinary|UPHase|PPHa se } :CALCulate{[1]|2|3|4|5|6|7|8|9|10|11 |12|13|14|15|16}[:SELected]:FORMat?,Selects the data format of the active trace of channel 1 (:CALC1) to channel 16 (:CALC16) (specified with the :CALC{1-16}:PAR{1-16}:SEL command).
:CALCulate{[1]|2|3|4|5|6|7|8|9|10|11|12|13|14|15|16}:FSIMula tor:BALun:CZConversion:BPORt{[1]|2}:IMAGinary <numeric> :CALCulate{[1]|2 |3|4 |5|6|7|8|9|10|11 |12|13|1 4|15 |16}:F SIMulator:BALun:CZConversion:BPORt{[1]|2}:IMAGinary?,"For balance port 1 (:BPOR1) or balance po rt2(:BPOR2) of channel 1 (:CALC1) to channel 16 (:CALC16),sets the impedancevalue (imaginarypart)forthe commonport  impedance conversion function. For details about the balance port number, see Figure 6-2 on page153."
:C ALC ulate{[1]|2|3|4|5|6|7|8|9|10|11|12|13|14|15|16}:FSIM u lator:BALun:CZConversion:BPORt{[1]|2}:REAL <numeric> :CALCulate{[1]|2|3|4|5|6|7|8|9|10|11|12|13|14|15|16} :FSIMulator:BALun:CZConversion:BPORt{[1]|2}:REAL?,"For balance port 1 (:BPOR1) or balance po rt2(:BPOR2) of channel 1 (:CALC1) to chann el 16 (:CALC16),sets the impedan ce value (realpart) for the commonport impedan ce con version fu nctio n. For details about the balance port number, see Figure 6-2 on page153. NOTE This command functions in the same way as :CALC{1-16}:FSIM:BAL:CZC:BPOR{1-2}:Z0 on page325"
:C ALC ulate{[1]|2|3|4|5|6|7|8|9|10|11|12|13|14|15|16}:FSIM u lator:BALun:CZConversion:BPO Rt{[1]|2}:Z0[:R] <numeric> :CALCulate{[1]|2 |3|4 |5|6|7|8|9|10|11 |12|13|1 4|15 |16}:F SIMulator:BALun:CZConversion:BPORt{[1]|2}:Z0[:R]?,"For balance port 1 (:BPOR1) or balance po rt2(:BPOR2) of channel 1 (:CALC1) to chann el 16 (:CALC16),sets the impedan ce value for the common port impedance conversion function. For details about the balance port number, see Figure 6-2 on page153."
:CALCulate{[1]|2|3|4|5|6|7|8|9|10|11|12|13|14|15|16} :FSIMulator:BALun:CZConve rsion:STATe {ON|OFF|1|0} :CALCulate{[1]|2|3|4|5|6|7|8|9|10|11|12|13|14|15|16}:FSIMulator:BALun:CZConversion:STATe?,"For all thebalance ports of channel 1 (:CALC1) tochannel 16(:CALC16), turnsON/OFF the common port impedance conversion function when thefixture simulator function is  ON (ON is specified with the :CALC{1-16}:FSIM:STAT command)."
:C ALC ulate{[1]|2|3|4|5|6|7|8|9|10|11|12|13|14|15|16}:FSI Mulator:BALun:DEVice {SBALa nced|BBALanced|SSBalanced} :C ALC ulate{[1]|2|3|4|5|6|7|8|9|10|11| 12|13|14|15|16}:FSIMulator:BALun:DEVice?,"For channel 1 (:CALC1) tochannel 16(:CALC16), selectsthe balance devicetype ofthe fixture simulator function. For details about the balance device type, see Figure 6-2 on page153."
:CALCulate{[1]|2|3|4|5|6|7|8|9|10|11|12|13|14| 15|16}:FSIMulator:BALun:DMCirc uit:BPORt{[1]|2} [:TYPE] {NONE|PLPC|USER} :CALCulate{[1]|2|3|4|5|6|7|8|9|10|11|12|13|14| 15|16}:FSIMulator:BALun:DMCirc uit:BPORt{[1]|2} [:TYPE]?,"For balance port 1 (:BPOR1) or balance po rt2(:BPOR2) of channel 1 (:CALC1) to channel 16 (:CALC16),selects thetype of thedifferential matching circuit. If you want  t o sel ect  t he user-defined ci rcui t, you must  speci fy the 2-port touchstone file in which the proper information on the user-defined circuit is saved in advance. If you do not  specify the appropriate file and youselectth e user-defined circuit, an error occurs and NON E is automaticallyselected. For details about the balance port numbe r,see figureFigure 6-2 on page153."
:CALCulate{[1]|2|3|4|5|6|7|8|9|10|11|12|13|14| 15|16}:FSIMulator:BALun:DMCirc uit:BPORt{[1]|2} :PARameters:C <numeric> :CALCulate{[1]|2|3|4|5|6|7|8|9|10|11|12|13|14| 15|16}:FSIMulator:BALun:DMCirc uit:BPORt{[1]|2} :PARameters:C?,"For balance port 1 (:BPOR1) or balance po rt2(:BPOR2) of channel 1 (:CALC1) to channe l 16 (:CALC16),sets the C valueof the differential matchingcircuit. For details about the balance port numbe r,see figureFigure 6-2 on page153."
:CALCulate{[1]|2|3|4|5|6|7|8|9|10|11|12|13|14| 15|16}:FSIMulator:BALun:DMCirc uit:BPORt{[1]|2} :PARameters:G <numeric> :CALCulate{[1]|2|3|4|5|6|7|8|9|10|11|12|13|14| 15|16}:FSIMulator:BALun:DMCirc uit:BPORt{[1]|2} :PARameters:G?,"For balance port 1 (:BPOR1) or balance po rt2(:BPOR2) of channel 1 (:CALC1) to channe l 16 (:CALC16),sets the G valueof the differential mat ching ci rcui t. For details about the balance port number, see Figure 6-2 on page153."
:CALCulate{[1]|2|3|4|5|6|7|8|9|10|11|12|13|14| 15|16}:FSIMulator:BALun:DMCirc uit:BPORt{[1]|2} :PARameters:L <numeric> :CALCulate{[1]|2|3|4|5|6|7|8|9|10|11|12|13|14| 15|16}:FSIMulator:BALun:DMCirc uit:BPORt{[1]|2} :PARameters:L?,"For balance port 1 (:BPOR1) or balance po rt2(:BPOR2) of channel 1 (:CALC1) to channel 16 (:CALC16),sets the Lvalue of the differential matching circuit. For details about the balance port number, see Figure 6-2 on page153."
:CALCulate{[1]|2|3|4|5|6|7|8|9|10|11|12|13|14| 15|16}:FSIMulator:BALun:DMCirc uit:BPORt{[1]|2} :PARameters:R <numeric> :CALCulate{[1]|2|3|4|5|6|7|8|9|10|11|12|13|14| 15|16}:FSIMulator:BALun:DMCirc uit:BPORt{[1]|2} :PARameters:R?,"For balance port 1 (:BPOR1) or balance po rt2(:BPOR2) of channel 1 (:CALC1) to channe l 16 (:CALC16),sets the R valueof the differential matchingcircuit. For details about the balance port number, see Figure 6-2 on page153."
:CALCulate{[1]|2|3|4|5|6|7|8|9|10|11|12|13|14| 15|16}:FSIMulator:BALun:DMCirc uit:BPORt{[1]|2} :USER:FILename <string> :CALCulate{[1]|2|3|4|5|6|7|8|9|10|11|12|13|14| 15|16}:FSIMulator:BALun:DMCirc uit:BPORt{[1]|2} :USER:FILename?,"For balance port 1 (:BPOR1) or balance po rt2(:BPOR2) of channel 1 (:CALC1) to channel 16 (:CALC16),specifies the file in which the information onthe user-defined differential matching circuit issaved(2-port touchstone file). Specifyt he fil ename wit h the .s2p extension.If youwant to specify afil eont he floppy disk drive, you need to add ﬁA:ﬂ at the beginning of the file name. When you use directory  names andfile name, separatethem with ﬁ/ﬂ (slash ) orﬁ\ﬂ (backslash). Even ifthe specified file does notexist,no error occurswhen yo u execute thiscommand *1 . However, whenyou set the typeof the differ ential matchingcircuit to theuser-defined circuit with the :CALC{1-16}:FSIM: BAL:DMC:BPOR{1-2} command, an error occurs. For details about the balance port number, see Figure 6-2 on page153."
:CALCulate{[1]|2|3|4|5|6 |7|8|9|10|11|12|13|14|15| 16}:FSIMulator:BALun:DMCirc uit:STATe {ON|OFF|1|0} :CALCulate{[1]|2|3|4|5|6|7|8 |9 |10|11 |12|13|14|15|16}:FSIMu lator:BA Lun:D MCircuit:STATe?,"For all thebalance ports of channel 1 (:CALC1) tochannel 16(:CALC16), turnsON/OFF the differential matching circuit embedding function whenthe fixturesimulatorfunctionis  ON (ON is specified with the :CALC{1-16}:FSIM:STAT command)."
:CALCulate{[1]|2|3|4|5|6|7|8|9|10|11|12|13 |14|15|16}: FSIMulator:BALun: DZConversion :BPORt{[1]|2}:IMAGinary <numeric> :CALCulate{[1]|2|3|4|5|6|7|8|9|10|11|12|13 |14|15|16}: FSIMulator:BALun: DZConversion :BPORt{[1]|2}:IMAGinary?,"For balance port 1 (:BPOR1) or balance po rt2(:BPOR2) of channel 1 (:CALC1) to channel 16 (:CALC16),sets the impedancevalue (imaginarypart)forthe differentialport  impedance conversion function. For details about the balance port number, see Figure 6-2 on page153."
:CALCulate{[1]|2|3|4|5|6|7|8|9|10|11|12|13 |14|15|16}: FSIMulator:BALun: DZConversion :BPORt{[1]|2}:REAL <numeric> :CALCulate{[1]|2|3|4|5|6|7|8|9|10|11|12|13 |14|15|16}: FSIMulator:BALun: DZConversion :BPORt{[1]|2}:REAL?,"For balance port 1 (:BPOR1) or balance po rt2(:BPOR2) of channel 1 (:CALC1) to chann el 16 (:CALC16),sets the impedan cev a lue (realpart) for the differential port impedan ce con version fu nctio n. For details about the balance port number, see Figure 6-2 on page153. NOTE This commandperformsin the same way as :CALC{1-16}:FSIM:BAL:DZC:BPOR{1-2}:Z0 on page337"
:CALCulate{[1]|2|3|4|5|6|7|8|9|10|11|12|13 |14|15|16}: FSIMulator:BALun: DZConversion :BPORt{[1]|2}:Z0 [:R] <numeric> :CALCulate{[1]|2|3|4|5|6|7|8|9|10|11|12|13 |14|15|16}: FSIMulator:BALun: DZConversion :BPORt{[1]|2}:Z0[:R]?,"For balance port 1 (:BPOR1) or balance po rt2(:BPOR2) of channel 1 (:CALC1) to chann el 16 (:CALC16),sets the impedan ce value for the differential port impedance conversion function. For details about the balance port number, see Figure 6-2 on page153."
:CALCulate{[1]|2|3|4|5|6|7|8|9|10|11|12|13|14|15|16} :FSIMulator:BALun:DZConv ersion:STATe {ON|OFF|1|0} :CALCulate{[1] |2|3|4|5|6|7|8|9|10|11|12|13|14|15|16}:FSIMulator:BALun:DZConversion:STATe?,"For all thebalance ports of channel 1 (:CALC1) tochannel 16(:CALC16), turnsON/OFF the di ff erent ial port im pedance conversi on function when thefixt ure sim ulat or functi on is  ON (ON is specified with the :CALC{1-16}:FSIM:STAT command)."
:CALCulate{[ 1] |2|3|4|5|6|7|8|9|10|11|12|13|14|15|16}:F SI Mulato r: BALun:PARamet er{[1]|2|3|4|5| 6|7| 8|9| 10|11|12| 13|14|15|16} :BBALanced[:DEFine] {SDD11|SDD21|S DD12|SDD22|SCD11|SCD21|SCD12|SCD22|SDC11|SDC21|SDC12|SDC22|SCC11| SCC21|SCC12|SCC22|IMB1|IMB2| CMRR} :CALCulate{[ 1] |2|3|4|5|6|7|8|9|10|11|12|13|14|15|16}:F SI Mulato r: BALun:PARamet er{[1]|2|3|4|5| 6|7| 8|9| 10|11|12| 13|14|15|16} :BBALanced[:DEFine]?,"For channe l 1 (:CALC1) tochannel 16(:CALC 16), sets themeasurementparameters of trace1 (:PAR1) totrace 16 (:PAR16) when the balance devicetype is setto ﬁbalance-balanceﬂ(BBAL is specified withthe :CALC{1-16}:FSIM:BAL:DEV  command)."
:CALCulate{[ 1] |2|3|4|5|6|7|8|9|10|11|12|13|14|15|16}:F SI Mulato r:BALun:PARamet er{[1]|2|3|4|5| 6|7| 8|9| 10|11|12| 13|14|15|16} :SBALanced[:DEFine] {SSS11|SDS 21| SSD12| SCS21| SSC12| SDD22|SCD22| SDC22|SCC22|IMB|CMRR|CMRR2} :CALCulate{[ 1] |2|3|4|5|6|7|8|9|10|11|12|13|14|15|16}:F SI Mulato r:BALun:PARamet er{[1]|2|3|4|5| 6|7| 8|9| 10|11|12| 13|14|15|16} :SBALanced[:DEFine]?,"For channe l 1 (:CALC1) tochannel 16(:CALC 16), sets themeasurementparameters of trace1 (:PAR1) totrace 16 (:PAR16) when the balance devicetype is setto ﬁunbalance-balanceﬂ (SBAL is specified withthe :CALC{1-16}:FSIM:BAL: DEV  command)."
:CALCulate{[ 1] |2|3|4|5|6|7|8|9|10|11|12|13|14|15|16}:F SI Mulato r: BALun:PARamet er{[1]|2|3|4|5| 6|7| 8|9| 10|11|12| 13|14|15|16} :SSBalanced[:DEFine] {SSS11|SSS21|SSS12|SSS22|SDS31|SD S32|SSD13|SSD23|SCS31|SCS3 2|SSC13|SSC23|SDD33|SCD33| SDC33|SCC33|IMB1|IMB2|IMB3|IMB4|CMRR1|CMRR2} :CALCulate{[ 1] |2|3|4|5|6|7|8|9|10|11|12|13|14|15|16}:F SI Mulato r: BALun:PARamet er{[1]|2|3|4|5| 6|7| 8|9| 10|11|12| 13|14|15|16} :SSBalanced[:DEFine]?,"For channe l 1 (:CALC1) tochannel 16(:CALC 16), sets themeasurementparameters of trace1 (:PAR1) totrace 16 (:PAR16) when the balance devicetype is setto ﬁunbalance-unbalance-balanceﬂ (S SB is specified with the :CALC{1-16}:FSIM:BAL: DEV  command)."
